{
  "$schema": "http://json-schema.org/draft-07/schema#",
  "$id": "urn:archsift:inproject:payload-manifest:v1",
  "type": "object",
  "additionalProperties": false,
  "required": ["schemaVersion", "product", "version", "rid", "sourceCommit", "contractVersion", "files"],
  "properties": {
    "schemaVersion": { "const": 1 },
    "product": { "const": "ArchSift.InProject" },
    "version": { "type": "string", "pattern": "^[0-9]+\\.[0-9]+\\.[0-9]+(?:-[0-9A-Za-z.-]+)?$" },
    "rid": { "const": "win-x64" },
    "sourceCommit": { "type": "string", "pattern": "^[0-9a-f]{40}$" },
    "contractVersion": { "const": 1 },
    "files": {
      "type": "array",
      "minItems": 1,
      "items": {
        "type": "object",
        "additionalProperties": false,
        "required": ["path", "bytes", "sha256"],
        "properties": {
          "path": { "type": "string", "minLength": 1 },
          "bytes": { "type": "integer", "minimum": 0 },
          "sha256": { "type": "string", "pattern": "^[0-9a-f]{64}$" }
        }
      }
    }
  }
}
